{
  "schemaVersion": "1.0.0",
  "versaoDados": "go-reposicao-demo-2026-10-07-r1",
  "natureza": "demonstrativa",
  "conjuntoId": "go-reposicao-demo-2026-10-07-r1",
  "aviso": "Preços fictícios para avaliação acadêmica. Não são cotações reais, estimativas de mercado ou recomendações de negociação.",
  "versaoTerritorial": "imb-regplan-2018",
  "condicoesComerciais": [
    {
      "id": "avista-sem-frete-sem-tributos",
      "pagamento": "à vista",
      "frete": "excluído",
      "tributos": "excluídos",
      "descricao": "Preço fictício do animal por cabeça, à vista, sem frete nem tributos."
    }
  ],
  "publicadoEm": "2026-10-07T12:00:00.000Z",
  "janela": {
    "inicio": "2025-10-01",
    "fim": "2026-09-30",
    "primeiraSemana": "2025-10-06",
    "ultimaSemana": "2026-09-28",
    "semanaAnterior": "2025-09-29",
    "quantidadeSemanasNaJanela": 52
  },
  "referenciasFontes": [
    {
      "id": "scot-reposicao",
      "instituicao": "Scot Consultoria",
      "url": "https://www.scotconsultoria.com.br/cotacoes/reposicao/",
      "consultadaEm": "2026-10-07",
      "uso": "Idades e pesos dos oito perfis; ordem de grandeza dos preços de reposição em Goiás. Nenhuma série ou preço observado foi importado."
    },
    {
      "id": "imb-regplan-2018",
      "instituicao": "Instituto Mauro Borges",
      "url": "https://goias.gov.br/imb/regioes-de-planejamento-do-estado-de-goias-2018/",
      "consultadaEm": "2026-10-07",
      "uso": "Coluna A da Tabela 01 nas dez folhas regionais terminadas em 3; classificação municipal congelada nesta edição."
    }
  ],
  "perfis": [
    {
      "id": "bezerro-macho-nelore",
      "ordem": 1,
      "categoria": "Bezerro",
      "sexo": "Macho",
      "grupoRacial": "Nelore",
      "idadeReferenciaMeses": 12,
      "pesoReferencia": "240.00",
      "unidadePeso": "kg",
      "referenciaParametrosId": "scot-reposicao"
    },
    {
      "id": "bezerro-macho-mestico",
      "ordem": 2,
      "categoria": "Bezerro",
      "sexo": "Macho",
      "grupoRacial": "Mestiço",
      "idadeReferenciaMeses": 12,
      "pesoReferencia": "205.00",
      "unidadePeso": "kg",
      "referenciaParametrosId": "scot-reposicao"
    },
    {
      "id": "bezerra-femea-nelore",
      "ordem": 3,
      "categoria": "Bezerra",
      "sexo": "Fêmea",
      "grupoRacial": "Nelore",
      "idadeReferenciaMeses": 12,
      "pesoReferencia": "210.00",
      "unidadePeso": "kg",
      "referenciaParametrosId": "scot-reposicao"
    },
    {
      "id": "bezerra-femea-mestica",
      "ordem": 4,
      "categoria": "Bezerra",
      "sexo": "Fêmea",
      "grupoRacial": "Mestiça",
      "idadeReferenciaMeses": 12,
      "pesoReferencia": "195.00",
      "unidadePeso": "kg",
      "referenciaParametrosId": "scot-reposicao"
    },
    {
      "id": "garrote-macho-nelore",
      "ordem": 5,
      "categoria": "Garrote",
      "sexo": "Macho",
      "grupoRacial": "Nelore",
      "idadeReferenciaMeses": 18,
      "pesoReferencia": "300.00",
      "unidadePeso": "kg",
      "referenciaParametrosId": "scot-reposicao"
    },
    {
      "id": "garrote-macho-mestico",
      "ordem": 6,
      "categoria": "Garrote",
      "sexo": "Macho",
      "grupoRacial": "Mestiço",
      "idadeReferenciaMeses": 18,
      "pesoReferencia": "255.00",
      "unidadePeso": "kg",
      "referenciaParametrosId": "scot-reposicao"
    },
    {
      "id": "novilha-femea-nelore",
      "ordem": 7,
      "categoria": "Novilha",
      "sexo": "Fêmea",
      "grupoRacial": "Nelore",
      "idadeReferenciaMeses": 18,
      "pesoReferencia": "270.00",
      "unidadePeso": "kg",
      "referenciaParametrosId": "scot-reposicao"
    },
    {
      "id": "novilha-femea-mestica",
      "ordem": 8,
      "categoria": "Novilha",
      "sexo": "Fêmea",
      "grupoRacial": "Mestiça",
      "idadeReferenciaMeses": 18,
      "pesoReferencia": "255.00",
      "unidadePeso": "kg",
      "referenciaParametrosId": "scot-reposicao"
    }
  ],
  "regioes": [
    {
      "id": "metropolitana-goiania",
      "ordem": 1,
      "codigoImb": "001",
      "nome": "Região Metropolitana de Goiânia",
      "versaoTerritorial": "imb-regplan-2018",
      "quantidadeMunicipios": 20
    },
    {
      "id": "centro-goiano",
      "ordem": 2,
      "codigoImb": "002",
      "nome": "Região Centro Goiano (Eixo BR-153)",
      "versaoTerritorial": "imb-regplan-2018",
      "quantidadeMunicipios": 31
    },
    {
      "id": "norte-goiano",
      "ordem": 3,
      "codigoImb": "003",
      "nome": "Região Norte Goiano",
      "versaoTerritorial": "imb-regplan-2018",
      "quantidadeMunicipios": 26
    },
    {
      "id": "nordeste-goiano",
      "ordem": 4,
      "codigoImb": "004",
      "nome": "Região Nordeste Goiano",
      "versaoTerritorial": "imb-regplan-2018",
      "quantidadeMunicipios": 20
    },
    {
      "id": "entorno-df",
      "ordem": 5,
      "codigoImb": "005",
      "nome": "Região Entorno do Distrito Federal",
      "versaoTerritorial": "imb-regplan-2018",
      "quantidadeMunicipios": 19
    },
    {
      "id": "sudeste-goiano",
      "ordem": 6,
      "codigoImb": "006",
      "nome": "Região Sudeste Goiano (Estrada-de-Ferro)",
      "versaoTerritorial": "imb-regplan-2018",
      "quantidadeMunicipios": 22
    },
    {
      "id": "sul-goiano",
      "ordem": 7,
      "codigoImb": "007",
      "nome": "Região Sul Goiano",
      "versaoTerritorial": "imb-regplan-2018",
      "quantidadeMunicipios": 26
    },
    {
      "id": "sudoeste-goiano",
      "ordem": 8,
      "codigoImb": "008",
      "nome": "Região Sudoeste Goiano",
      "versaoTerritorial": "imb-regplan-2018",
      "quantidadeMunicipios": 26
    },
    {
      "id": "oeste-goiano",
      "ordem": 9,
      "codigoImb": "009",
      "nome": "Região Oeste Goiano (Eixo GO-060)",
      "versaoTerritorial": "imb-regplan-2018",
      "quantidadeMunicipios": 43
    },
    {
      "id": "noroeste-goiano",
      "ordem": 10,
      "codigoImb": "010",
      "nome": "Região Noroeste Goiano (Estrada do Boi)",
      "versaoTerritorial": "imb-regplan-2018",
      "quantidadeMunicipios": 13
    }
  ],
  "referenciasSemanais": [
    {
      "perfilId": "bezerro-macho-nelore",
      "semana": "2026-09-21",
      "regioesAusentes": [
        "oeste-goiano",
        "noroeste-goiano"
      ]
    },
    {
      "perfilId": "bezerro-macho-mestico",
      "semana": "2026-09-21",
      "regioesAusentes": []
    },
    {
      "perfilId": "bezerra-femea-nelore",
      "semana": "2026-09-21",
      "regioesAusentes": []
    },
    {
      "perfilId": "bezerra-femea-mestica",
      "semana": "2026-09-21",
      "regioesAusentes": []
    },
    {
      "perfilId": "garrote-macho-nelore",
      "semana": "2026-09-21",
      "regioesAusentes": []
    },
    {
      "perfilId": "garrote-macho-mestico",
      "semana": "2026-09-21",
      "regioesAusentes": []
    },
    {
      "perfilId": "novilha-femea-nelore",
      "semana": "2026-09-21",
      "regioesAusentes": []
    },
    {
      "perfilId": "novilha-femea-mestica",
      "semana": "2026-09-21",
      "regioesAusentes": []
    },
    {
      "perfilId": "bezerro-macho-nelore",
      "semana": "2026-09-28",
      "regioesAusentes": [
        "metropolitana-goiania",
        "centro-goiano"
      ]
    },
    {
      "perfilId": "bezerro-macho-mestico",
      "semana": "2026-09-28",
      "regioesAusentes": []
    },
    {
      "perfilId": "bezerra-femea-nelore",
      "semana": "2026-09-28",
      "regioesAusentes": []
    },
    {
      "perfilId": "bezerra-femea-mestica",
      "semana": "2026-09-28",
      "regioesAusentes": []
    },
    {
      "perfilId": "garrote-macho-nelore",
      "semana": "2026-09-28",
      "regioesAusentes": []
    },
    {
      "perfilId": "garrote-macho-mestico",
      "semana": "2026-09-28",
      "regioesAusentes": []
    },
    {
      "perfilId": "novilha-femea-nelore",
      "semana": "2026-09-28",
      "regioesAusentes": []
    },
    {
      "perfilId": "novilha-femea-mestica",
      "semana": "2026-09-28",
      "regioesAusentes": []
    }
  ],
  "precos": [
    {
      "perfilId": "bezerro-macho-nelore",
      "regiaoId": "metropolitana-goiania",
      "semana": "2026-09-21",
      "preco": "2950.00",
      "moeda": "BRL",
      "unidadePreco": "cabeca",
      "natureza": "demonstrativa",
      "conjuntoId": "go-reposicao-demo-2026-10-07-r1",
      "condicoesComerciaisId": "avista-sem-frete-sem-tributos"
    },
    {
      "perfilId": "bezerro-macho-nelore",
      "regiaoId": "centro-goiano",
      "semana": "2026-09-21",
      "preco": "3050.00",
      "moeda": "BRL",
      "unidadePreco": "cabeca",
      "natureza": "demonstrativa",
      "conjuntoId": "go-reposicao-demo-2026-10-07-r1",
      "condicoesComerciaisId": "avista-sem-frete-sem-tributos"
    },
    {
      "perfilId": "bezerro-macho-nelore",
      "regiaoId": "norte-goiano",
      "semana": "2026-09-21",
      "preco": "3150.00",
      "moeda": "BRL",
      "unidadePreco": "cabeca",
      "natureza": "demonstrativa",
      "conjuntoId": "go-reposicao-demo-2026-10-07-r1",
      "condicoesComerciaisId": "avista-sem-frete-sem-tributos"
    },
    {
      "perfilId": "bezerro-macho-nelore",
      "regiaoId": "nordeste-goiano",
      "semana": "2026-09-21",
      "preco": "3250.00",
      "moeda": "BRL",
      "unidadePreco": "cabeca",
      "natureza": "demonstrativa",
      "conjuntoId": "go-reposicao-demo-2026-10-07-r1",
      "condicoesComerciaisId": "avista-sem-frete-sem-tributos"
    },
    {
      "perfilId": "bezerro-macho-nelore",
      "regiaoId": "entorno-df",
      "semana": "2026-09-21",
      "preco": "3350.00",
      "moeda": "BRL",
      "unidadePreco": "cabeca",
      "natureza": "demonstrativa",
      "conjuntoId": "go-reposicao-demo-2026-10-07-r1",
      "condicoesComerciaisId": "avista-sem-frete-sem-tributos"
    },
    {
      "perfilId": "bezerro-macho-nelore",
      "regiaoId": "sudeste-goiano",
      "semana": "2026-09-21",